{
  "version": "1.0.0",
  "type": "Studios",
  "totalCount": 1,
  "items": [
    {
      "id": "mate-lajos-dombovar",
      "order": 1,
      "featured": true,
      "metadata": {
        "region": "Tolna",
        "era": "interwar-period"
      }
    }
  ],
  "lastUpdated": "2025-10-15T00:00:00Z"
}
